{
  "analysis_mode": "context_extraction",
  "arrays": [
    {
      "category": "Bona-fide",
      "consensus_repeat": "CGTTTTAGTTACTTATTGTGAAATGTAAAT",
      "id": "identify:c1e77d030be6009e992b1fca4dc4e56731d0da972110e2b4846a77a890b87965",
      "metadata": {
        "identify_original": {
          "architecture": [
            {
              "index": 1,
              "sequence": "CGTTTTAGTTACTTATTGTGAAATGTAAAT",
              "source_interval": {
                "end": 451,
                "length": 30,
                "start": 422
              },
              "type": "repeat"
            },
            {
              "index": 1,
              "sequence": "ACAGATCAAACTCCGGAAGGGTGATTGTAAATGG",
              "source_interval": {
                "end": 485,
                "length": 34,
                "start": 452
              },
              "type": "spacer"
            },
            {
              "index": 2,
              "sequence": "CGTTTTAGTTACTTATTGTGAAATGTAAAT",
              "source_interval": {
                "end": 515,
                "length": 30,
                "start": 486
              },
              "type": "repeat"
            },
            {
              "index": 2,
              "sequence": "TGCTCTCTTTTGTGTAAAGCACATCAAGCATGTAG",
              "source_interval": {
                "end": 550,
                "length": 35,
                "start": 516
              },
              "type": "spacer"
            },
            {
              "index": 3,
              "sequence": "CGTTTTAGTTACTTATTGTGAAATGTAAAT",
              "source_interval": {
                "end": 580,
                "length": 30,
                "start": 551
              },
              "type": "repeat"
            }
          ],
          "boundary_assessment": {
            "alternative_relationships": [],
            "assessment_id": "boundary-assessment-sha256:88c00453574cf09df318ca266150f3ecb9c93adea7650f76b1a36ed691d6eb18",
            "coordinate_system": {
              "empty_spacers": {
                "indexing": 0,
                "name": "zero_based_interbase",
                "one_based_inclusive_interval": null,
                "reference": "original_input_forward_strand",
                "representation": "interbase_boundary"
              },
              "internal": {
                "end_exclusive": true,
                "indexing": 0,
                "name": "zero_based_half_open",
                "reference": "original_input_forward_strand"
              },
              "public_nonempty_intervals": {
                "conversion": "public_start=internal_start+1; public_end=internal_end",
                "end_inclusive": true,
                "indexing": 1,
                "name": "one_based_inclusive",
                "reference": "original_input_forward_strand"
              }
            },
            "dimensions": {
              "occurrence_path": {
                "alternative_geometry_ids": [],
                "dimension": "occurrence_path",
                "reason_codes": [],
                "reported_geometry_role": "representative",
                "representative_geometry_id": "boundary-geometry-sha256:43fadc94a2b41db91cc61b0f2f77e5d14dc72932e65ebc244d7ff5c5683fb994",
                "selection_policy_id": null,
                "status": "unassessed"
              },
              "repeat_phase": {
                "alternative_geometry_ids": [],
                "dimension": "repeat_phase",
                "reason_codes": [],
                "reported_geometry_role": "representative",
                "representative_geometry_id": "boundary-geometry-sha256:43fadc94a2b41db91cc61b0f2f77e5d14dc72932e65ebc244d7ff5c5683fb994",
                "selection_policy_id": null,
                "status": "unassessed"
              }
            },
            "integration_contract": {
              "alternative_relationship_semantics": "explicit_labeled_source_valid_geometries_only",
              "fuzzy_family_semantics": "shared_fuzzy_family_id_is_not_alternative_evidence",
              "internal_coordinates": "zero_based_half_open",
              "mutation_semantics": "pure_normalization_no_candidate_category_or_pipeline_mutation",
              "public_coordinates": "one_based_inclusive_for_nonempty_intervals_and_zero_based_interbase_for_empty_spacers",
              "reported_geometry_semantics": "representative_never_implicitly_exact",
              "source_hash_scope": "uppercase_sequence",
              "source_requirement": "complete_original_input_forward_strand_sequence_is_required",
              "status_semantics": [
                "unassessed_means_no_explicit_alternative_was_adjudicated",
                "policy_selected_means_policy_chose_the_representative_not_exact",
                "ambiguous_means_one_or_more_explicit_alternatives_remain"
              ]
            },
            "reported_geometry": {
              "exact_boundary_claim": false,
              "geometry_id": "boundary-geometry-sha256:43fadc94a2b41db91cc61b0f2f77e5d14dc72932e65ebc244d7ff5c5683fb994",
              "repeat_count": 3,
              "repeats": [
                {
                  "interval": {
                    "internal_0based_half_open": {
                      "end": 451,
                      "start": 421
                    },
                    "length": 30,
                    "public_1based_inclusive": {
                      "end": 451,
                      "start": 422
                    }
                  },
                  "ordinal": 1,
                  "sequence": "CGTTTTAGTTACTTATTGTGAAATGTAAAT",
                  "sha256": "26d7f0f54508a4aadd14484d0a75e552d81f4e8a79149cef7a312feaac909c17",
                  "sha256_scope": "uppercase_source_slice"
                },
                {
                  "interval": {
                    "internal_0based_half_open": {
                      "end": 515,
                      "start": 485
                    },
                    "length": 30,
                    "public_1based_inclusive": {
                      "end": 515,
                      "start": 486
                    }
                  },
                  "ordinal": 2,
                  "sequence": "CGTTTTAGTTACTTATTGTGAAATGTAAAT",
                  "sha256": "26d7f0f54508a4aadd14484d0a75e552d81f4e8a79149cef7a312feaac909c17",
                  "sha256_scope": "uppercase_source_slice"
                },
                {
                  "interval": {
                    "internal_0based_half_open": {
                      "end": 580,
                      "start": 550
                    },
                    "length": 30,
                    "public_1based_inclusive": {
                      "end": 580,
                      "start": 551
                    }
                  },
                  "ordinal": 3,
                  "sequence": "CGTTTTAGTTACTTATTGTGAAATGTAAAT",
                  "sha256": "26d7f0f54508a4aadd14484d0a75e552d81f4e8a79149cef7a312feaac909c17",
                  "sha256_scope": "uppercase_source_slice"
                }
              ],
              "role": "representative",
              "source_interval": {
                "internal_0based_half_open": {
                  "end": 580,
                  "start": 421
                },
                "length": 159,
                "public_1based_inclusive": {
                  "end": 580,
                  "start": 422
                }
              },
              "source_sha256": "db767896bd39a3b7149c37385493a6a5bb89b255b15e88d76a383f4f8e7c3157",
              "source_slice_sha256": "f62f33c43dd212a0387543a8fc54b5697a4301246fd24696aa2cd1ee7b171cdc",
              "source_slice_sha256_scope": "uppercase_source_slice",
              "spacer_count": 2,
              "spacers": [
                {
                  "interval": {
                    "internal_0based_half_open": {
                      "end": 485,
                      "start": 451
                    },
                    "length": 34,
                    "public_1based_inclusive": {
                      "end": 485,
                      "start": 452
                    }
                  },
                  "ordinal": 1,
                  "sequence": "ACAGATCAAACTCCGGAAGGGTGATTGTAAATGG",
                  "sha256": "53c944ab10213278f5ed6175c836e98b8c594513524be62a33397ac5812b8f3d",
                  "sha256_scope": "uppercase_source_slice"
                },
                {
                  "interval": {
                    "internal_0based_half_open": {
                      "end": 550,
                      "start": 515
                    },
                    "length": 35,
                    "public_1based_inclusive": {
                      "end": 550,
                      "start": 516
                    }
                  },
                  "ordinal": 2,
                  "sequence": "TGCTCTCTTTTGTGTAAAGCACATCAAGCATGTAG",
                  "sha256": "a31be9635fd505629aa0332eea91facaa69e77d6ca016e7ace888388169fff58",
                  "sha256_scope": "uppercase_source_slice"
                }
              ]
            },
            "reported_geometry_role": "representative",
            "schema": {
              "name": "crispridentify.boundary_assessment",
              "version": "1.0.0"
            },
            "source": {
              "length": 1121,
              "reference": "original_input_forward_strand",
              "sha256": "db767896bd39a3b7149c37385493a6a5bb89b255b15e88d76a383f4f8e7c3157",
              "sha256_scope": "uppercase_sequence"
            }
          },
          "category": "Bona-fide",
          "category_key": "bona-fide",
          "category_position": 0,
          "certainty_score": 0.7508878399378084,
          "classification_basis": {
            "coordinate_system": "zero_based_half_open",